<?xml version="1.1" encoding="UTF-8"?>
<!DOCTYPE Afpx_Descriptors SYSTEM "../../reposit/Afpx.dtd">

<!-- For renardeau -->
<Afpx_Descriptors Height="29" Width="40">
  <Color_Definitions>
    <Color_Definition Id="Color09" Color="Dark_Grey"/>
  </Color_Definitions>

  <!-- Main screen -->
  <Descriptor Num="1" Background="Light_Grey">

    <Var Name="TxtStart"  Value="${Screen.Width}-16"/>

    <!-- Title -->
    <Field Num="1" Kind="Put">
      <Geometry Up="1" Left="0" Height="1" Width="${Screen.Width}"/>
      <Colors Foreground="Black" Background="Light_Grey" />
      <Init Row="0" Col="12">R E N A R D E A U</Init>
    </Field>

    <!-- Base numbers (6) -->
    <Field Num="2" Kind="Put">
      <Geometry Up="${Field_1.Low}+2" Left="1"
                Height="1" Width="3"/>
      <Colors Foreground="Black" Background="Light_Grey" />
    </Field>
    <Field Num="3" Kind="Put">
      <Geometry Up="${Field_1.Low}+2" Left="${Field_2.Right}+2"
                Height="1" Width="3"/>
      <Colors Foreground="Black" Background="Light_Grey" />
    </Field>
    <Field Num="4" Kind="Put">
      <Geometry Up="${Field_1.Low}+2" Left="${Field_3.Right}+2"
                Height="1" Width="3"/>
      <Colors Foreground="Black" Background="Light_Grey" />
    </Field>
    <Field Num="5" Kind="Put">
      <Geometry Up="${Field_1.Low}+2" Left="${Field_4.Right}+2"
                Height="1" Width="3"/>
      <Colors Foreground="Black" Background="Light_Grey" />
    </Field>
    <Field Num="6" Kind="Put">
      <Geometry Up="${Field_1.Low}+2" Left="${Field_5.Right}+2"
                Height="1" Width="3"/>
      <Colors Foreground="Black" Background="Light_Grey" />
    </Field>
    <Field Num="7" Kind="Put">
      <Geometry Up="${Field_1.Low}+2" Left="${Field_6.Right}+2"
                Height="1" Width="3"/>
      <Colors Foreground="Black" Background="Light_Grey" />
    </Field>
    <!-- Target number -->
    <Field Num="8" Kind="Put">
      <Geometry Up="${Field_1.Low}+2" Left="${Screen.Right}-3"
                Height="1" Width="3"/>
      <Colors Foreground="Black" Background="Light_Grey" />
    </Field>

    <!-- Buttons -->
    <Field Num="9" Kind="Button">
      <Geometry Up="${Field_2.Low}+2" Left="1"
                Height="3" Width="4"/>
      <Colors Foreground="Black" Background="Dark_Grey"/>
      <Init Row="1" Col="1">10</Init>
    </Field>
    <Field Num="10" Kind="Button">
      <Geometry Up="${Field_2.Low}+2" Left="${Field_9.Right}+2"
                Height="3" Width="4"/>
      <Colors Foreground="Black" Background="Dark_Grey"/>
      <Init Row="1" Col="1">25</Init>
    </Field>
    <Field Num="11" Kind="Button">
      <Geometry Up="${Field_2.Low}+2" Left="${Field_10.Right}+2"
                Height="3" Width="4"/>
      <Colors Foreground="Black" Background="Dark_Grey"/>
      <Init Row="1" Col="1">50</Init>
    </Field>
    <Field Num="12" Kind="Button">
      <Geometry Up="${Field_2.Low}+2" Left="${Field_11.Right}+2"
                Height="3" Width="4"/>
      <Colors Foreground="Black" Background="Dark_Grey"/>
      <Init Row="1" Col="1">75</Init>
    </Field>
    <Field Num="13" Kind="Button">
      <Geometry Up="${Field_2.Low}+2" Left="${Field_12.Right}+2"
                Height="3" Width="5"/>
      <Colors Foreground="Black" Background="Dark_Grey"/>
      <Init Row="1" Col="1">100</Init>
    </Field>

    <Field Num="14" Kind="Button">
      <Geometry Up="${Field_9.Low}+2" Left="2"
                Height="3" Width="5"/>
      <Colors Foreground="Black" Background="Dark_Grey"/>
      <Init Row="1" Col="2">7</Init>
    </Field>
    <Field Num="15" Kind="Button">
      <Geometry Up="${Field_9.Low}+2" Left="${Field_14.Right}+2"
                Height="3" Width="5"/>
      <Colors Foreground="Black" Background="Dark_Grey"/>
      <Init Row="1" Col="2">8</Init>
    </Field>
    <Field Num="16" Kind="Button">
      <Geometry Up="${Field_9.Low}+2" Left="${Field_15.Right}+2"
                Height="3" Width="5"/>
      <Colors Foreground="Black" Background="Dark_Grey"/>
      <Init Row="1" Col="2">9</Init>
    </Field>

    <Field Num="17" Kind="Button">
      <Geometry Up="${Field_14.Low}+2" Left="${Field_14.Left}"
                Height="3" Width="5"/>
      <Colors Foreground="Black" Background="Dark_Grey"/>
      <Init Row="1" Col="2">4</Init>
    </Field>
    <Field Num="18" Kind="Button">
      <Geometry Up="${Field_14.Low}+2" Left="${Field_17.Right}+2"
                Height="3" Width="5"/>
      <Colors Foreground="Black" Background="Dark_Grey"/>
      <Init Row="1" Col="2">5</Init>
    </Field>
    <Field Num="19" Kind="Button">
      <Geometry Up="${Field_14.Low}+2" Left="${Field_18.Right}+2"
                Height="3" Width="5"/>
      <Colors Foreground="Black" Background="Dark_Grey"/>
      <Init Row="1" Col="2">6</Init>
    </Field>

    <Field Num="20" Kind="Button">
      <Geometry Up="${Field_17.Low}+2" Left="${Field_14.Left}"
                Height="3" Width="5"/>
      <Colors Foreground="Black" Background="Dark_Grey"/>
      <Init Row="1" Col="2">1</Init>
    </Field>
    <Field Num="21" Kind="Button">
      <Geometry Up="${Field_17.Low}+2" Left="${Field_20.Right}+2"
                Height="3" Width="5"/>
      <Colors Foreground="Black" Background="Dark_Grey"/>
      <Init Row="1" Col="2">2</Init>
    </Field>
    <Field Num="22" Kind="Button">
      <Geometry Up="${Field_17.Low}+2" Left="${Field_21.Right}+2"
                Height="3" Width="5"/>
      <Colors Foreground="Black" Background="Dark_Grey"/>
      <Init Row="1" Col="2">3</Init>
    </Field>

    <Field Num="23" Kind="Button">
      <Geometry Up="${Field_20.Low}+2" Left="${Field_20.Left}"
                Height="3" Width="5"/>
      <Colors Foreground="Black" Background="Dark_Grey"/>
      <Init Row="1" Col="2">0</Init>
    </Field>
    <Field Num="24" Kind="Button">
      <Geometry Up="${Field_20.Low}+2" Left="${Field_23.Right}+2"
                Height="3" Right="${Field_22.Right}"/>
      <Colors Foreground="Black" Background="Dark_Grey"/>
      <Init Row="1" Col="1">E N T E R</Init>
    </Field>

    <Field Num="25" Kind="Button">
      <Geometry Up="${Field_23.Low}+2" Left="${Field_23.Left}"
                Height="3" Width="7"/>
      <Colors Foreground="Black" Background="Dark_Grey"/>
      <Init Row="1" Col="1">CLEAR</Init>
    </Field>
    <Field Num="26" Kind="Button">
      <Geometry Up="${Field_23.Low}+2" Right="${Field_24.Right}"
                Height="3" Width="7"/>
      <Colors Foreground="Black" Background="Dark_Grey"/>
      <Init Row="1" Col="1">RESET</Init>
    </Field>

    <!-- Result and computation -->
    <Field Num="27" Kind="Put">
      <Geometry Up="${Field_14.Up}" Left="${Field_8.Left}"
                Height="1" Width="3"/>
      <Colors Foreground="Lime_Green" Background="Light_Grey" />
    </Field>
    <Field Num="28" Kind="Put">
      <Geometry Up="${Field_27.Low}+2" Left="${TxtStart}"
                Height="1" Width="15"/>
      <Colors Foreground="Black" Background="Light_Grey" />
    </Field>
    <Field Num="29" Kind="Put">
      <Geometry Up="${Field_28.Low}+2" Left="${TxtStart}"
                Height="1" Width="15"/>
      <Colors Foreground="Black" Background="Light_Grey" />
    </Field>
    <Field Num="30" Kind="Put">
      <Geometry Up="${Field_29.Low}+2" Left="${TxtStart}"
                Height="1" Width="15"/>
      <Colors Foreground="Black" Background="Light_Grey" />
    </Field>
    <Field Num="31" Kind="Put">
      <Geometry Up="${Field_30.Low}+2" Left="${TxtStart}"
                Height="1" Width="15"/>
      <Colors Foreground="Black" Background="Light_Grey" />
    </Field>
    <Field Num="32" Kind="Put">
      <Geometry Up="${Field_31.Low}+2" Left="${TxtStart}"
                Height="1" Width="15"/>
      <Colors Foreground="Black" Background="Light_Grey" />
    </Field>

    <!-- OK and EXIT -->
    <Field Num="33" Kind="Button">
      <Geometry Up="${Field_26.Up}" Left="${Field_26.Right}+3"
                Height="3" Width="9"/>
      <Colors Foreground="Black" Background="Dark_Grey"/>
      <Init Row="1" Col="3">O K</Init>
    </Field>
    <Field Num="34" Kind="Button">
      <Geometry Up="${Field_33.Up}" Right="${Screen.Width}-2"
                Height="3" Width="6"/>
      <Colors Foreground="Black" Background="Dark_Grey"/>
      <Init Row="1" Col="1">EXIT</Init>
    </Field>

  </Descriptor>

</Afpx_Descriptors>

